{
  "warden_manifest_version": "1.0",
  "name": "fact-gate",
  "pack": "research-brain",
  "version": "1.0.0",
  "title": "Fact Gate",
  "summary": "Verify every factual, legal, or financial claim against a dated primary source before anything ships.",
  "description": "Extracts the checkable claims from a draft, blocks until each is matched to a dated primary source, and flags claim-classes a casual self-check misses (rates, phase-out limits, deadlines, jurisdiction/forum).",
  "author": "Warden Curated Pack",
  "license": "Apache-2.0",
  "kind": "instructions",
  "entrypoint": "SKILL.md",
  "input_schema": {
    "type": "object",
    "properties": {
      "task": { "type": "string", "description": "The text/draft whose claims must be verified." }
    },
    "required": ["task"]
  },
  "sandbox_profile": "isolated-no-net",
  "capabilities": {
    "network": "none",
    "filesystem_read": [],
    "filesystem_write": [],
    "shell": false,
    "subprocess": false,
    "secrets": false
  },
  "tests": ["tests/test.json"],
  "tags": ["research", "verification", "claims", "compliance"]
}
