{
  "warden_manifest_version": "1.0",
  "name": "build-product",
  "pack": "build-brain",
  "version": "1.0.0",
  "title": "Build Product",
  "summary": "Turn a validated idea into a complete, verified, shippable digital product to a top-tier bar.",
  "description": "A reasoning skill that plans and sequences a buildable deliverable (workbook, app, playbook, listing kit), insisting every artifact is verified rather than assumed, with empty-state guards and to-the-cent reconciliation.",
  "author": "Warden Curated Pack",
  "license": "Apache-2.0",
  "kind": "instructions",
  "entrypoint": "SKILL.md",
  "input_schema": {
    "type": "object",
    "properties": {
      "task": { "type": "string", "description": "What to build, e.g. 'a budgeting workbook for freelancers'." }
    },
    "required": ["task"]
  },
  "sandbox_profile": "isolated-no-net",
  "capabilities": {
    "network": "none",
    "filesystem_read": [],
    "filesystem_write": [],
    "shell": false,
    "subprocess": false,
    "secrets": false
  },
  "tests": ["tests/test.json"],
  "tags": ["build", "product", "delivery"]
}
