{
  "warden_manifest_version": "1.0",
  "name": "idea-scout",
  "pack": "research-brain",
  "version": "1.0.0",
  "title": "Idea Scout",
  "summary": "Find and rigorously score a net-new idea before building, with evidence gates and a mandatory pre-mortem.",
  "description": "A reasoning skill that turns a vague 'what should I build' into a scored, de-risked decision: evidence-gated demand, an anti-inflation rubric, blind-scout convergence, and a cheap test before any real work.",
  "author": "Warden Curated Pack",
  "license": "Apache-2.0",
  "kind": "instructions",
  "entrypoint": "SKILL.md",
  "input_schema": {
    "type": "object",
    "properties": {
      "task": { "type": "string", "description": "The domain or question, e.g. 'what tracker should I build next for nurses'." },
      "constraints": { "type": "string", "description": "Optional budget/time/audience constraints." }
    },
    "required": ["task"]
  },
  "sandbox_profile": "isolated-no-net",
  "capabilities": {
    "network": "none",
    "filesystem_read": [],
    "filesystem_write": [],
    "shell": false,
    "subprocess": false,
    "secrets": false
  },
  "tests": ["tests/test.json"],
  "tags": ["research", "ideation", "scoring", "validation"]
}
